[
  {
    "capture_source_ids": [],
    "delivery_enabled": false,
    "execute_function_ids": [
      "extract.job_quote_v1",
      "fixture.theme_v1",
      "sample.theme_summary_v1",
      "signal.required_facts_v1",
      "detect.raw_form_v1"
    ],
    "export_enabled": true,
    "fact_predicate_ids": [
      "vendor.present",
      "vendor.mentioned",
      "booking.present",
      "crm.present",
      "esp.present",
      "chat.widget.present",
      "payment.processor.present",
      "automation.platform.present",
      "integration.present",
      "website.platform",
      "vendor.certification_badge",
      "dns.mx.provider",
      "dns.dmarc.policy",
      "dns.spf.includes",
      "dns.txt.verification",
      "dns.cname.service",
      "cert.new_subdomain",
      "api.public.present",
      "app.mobile.present",
      "status.page.present",
      "schema.jsonld.present",
      "schema.jsonld.types",
      "schema.subject_binding",
      "content.page_inventory",
      "content.velocity_band",
      "content.type.present",
      "seo.cwv.field",
      "seo.indexation",
      "seo.keyword.footprint",
      "seo.authority",
      "seo.local.presence",
      "seo.ai_visibility.cited_in",
      "industry.vertical",
      "industry.subvertical",
      "company.self_claim",
      "company.locations",
      "company.geo",
      "company.age_band",
      "identity.binding_evidence",
      "firmo.employee_band",
      "firmo.revenue_band",
      "firmo.ownership",
      "firmo.funding",
      "person.contact",
      "review.metrics",
      "review.response_ratio",
      "competitor.presence",
      "hiring.role",
      "hiring.velocity",
      "ads.activity",
      "news.events",
      "headcount.history",
      "change.page.delta",
      "tech.rollback",
      "change.velocity",
      "outreach.outcome",
      "crm.note",
      "account.stage",
      "suppression.dnc",
      "tag.automation_maturity",
      "tag.marketing_maturity",
      "tag.growth_posture",
      "tag.platform_camp",
      "tag.regulated_vertical",
      "tag.size_class",
      "tag.location_model",
      "tag.industry",
      "tag.business_type",
      "tag.ai_surface_readiness",
      "tag.stack_complexity",
      "tag.sales_maturity",
      "tag.seasonality",
      "tag.icp_fit",
      "tag.data_quality",
      "cohort.baseline",
      "cohort.percentile",
      "cohort.trend",
      "cohort.outlier",
      "angle.performance",
      "integration.connection.verified",
      "ops.automation.verified",
      "ops.sales.verified",
      "company.business_model",
      "acquisition.coverage",
      "change.template.stable",
      "location.data.consistency",
      "outreach.exposure",
      "careers.page",
      "careers.ats",
      "job.posting",
      "job.status",
      "job.salary",
      "job.work_arrangement",
      "job.location",
      "job.skill_requirement",
      "job.department",
      "job.workflow_statement",
      "job.document_statement",
      "job.tool_statement",
      "job.handoff_statement",
      "job.manual_process_statement",
      "job.spreadsheet_statement",
      "job.crm_statement",
      "job.follow_up_statement",
      "hiring.change_event",
      "technology.footprint",
      "technology.provider_report",
      "technology.script",
      "technology.form_action",
      "technology.cookie",
      "technology.header",
      "technology.csp",
      "technology.subdomain",
      "technology.network_request",
      "technology.static_global",
      "technology.account_identifier",
      "technology.cooccurrence",
      "technology.change",
      "product.capability",
      "product.vertical",
      "product.category",
      "product.integration_support",
      "portal.observed",
      "integration.public_marker",
      "review.record",
      "review.statement",
      "review.owner_response",
      "review.theme_classification",
      "discussion.record",
      "discussion.statement",
      "discussion.theme_classification",
      "product.pain_prior",
      "industry.pain_prior",
      "review.theme_summary",
      "account.industry_membership",
      "search.result",
      "business.profile_attribute",
      "backlink.record",
      "web.mention",
      "web.mention_sentiment",
      "app.listing",
      "shopping.listing",
      "advertisement.record",
      "registry.registration",
      "registry.license",
      "registry.permit",
      "registry.specialty",
      "registry.filing",
      "registry.affiliation",
      "phone.cta",
      "phone.routing_observed",
      "phone.routing_verified",
      "phone.recording_verified",
      "phone.call_event",
      "phone.economics_hypothesis",
      "website.business_model_statement",
      "website.customer_type_statement",
      "website.lead_channel_statement",
      "website.sales_motion_statement",
      "website.document_type_statement",
      "website.handoff_statement",
      "website.intent_statement",
      "website.service_offering_statement",
      "website.geographic_market_statement",
      "website.workflow_step_statement",
      "website.role_responsibility_statement",
      "website.knowledge_source_statement",
      "website.intake_method_statement",
      "website.manual_process_statement",
      "website.approval_process_statement",
      "website.data_reentry_statement",
      "website.reporting_process_statement",
      "website.follow_up_statement",
      "website.billing_process_statement",
      "website.scheduling_process_statement",
      "website.compliance_process_statement",
      "workflow.hypothesis",
      "business_model.hypothesis",
      "customer_type.hypothesis",
      "lead_channel.hypothesis",
      "knowledge_complexity.hypothesis",
      "document_complexity.hypothesis",
      "handoff_risk.hypothesis",
      "automation_opportunity.hypothesis",
      "document.surface",
      "form.surface",
      "ads.measurement",
      "app.measurement",
      "hiring.measurement",
      "phone.measurement",
      "registry.measurement",
      "research.measurement",
      "review.measurement",
      "seo.measurement",
      "shopping.measurement",
      "technology.measurement",
      "traffic.measurement",
      "publication.record",
      "publication.statement",
      "organization.event_report",
      "repository.activity_observed",
      "event.public_participation",
      "event.authorized_attendance",
      "trade.shipment_record",
      "procurement.record",
      "legal.filing_record",
      "award.listing",
      "patent.application_record",
      "franchise.disclosure_record",
      "registry.financing_filing",
      "registry.loan_record",
      "case_study.report",
      "case_study.outcome_report"
    ],
    "product_boundary": "REVIEWED_HANDOFF",
    "production_enabled": false,
    "profile_id": "profile.broad_research",
    "research_context_enabled": true,
    "signal_ids": [
      "TECHNOLOGY_FOOTPRINT",
      "JOB_WORKFLOW_STATEMENT",
      "SCOPED_FORM_NONDETECTION"
    ],
    "template_ids": [
      "template.observed_product",
      "template.job_question",
      "template.scoped_absence"
    ],
    "version": "4.2.0"
  }
]
